{
  "$schema": "http://json-schema.org/draft-07/schema#",
  "$id": "https://himalayan-disaster-atlas.invalid/schemas/live-snapshot.schema.json",
  "type": "object",
  "additionalProperties": false,
  "required": ["schema_version", "kind", "dataset_id", "version", "id", "feed_id", "is_fixture", "source", "fetched_at", "source_issued_at", "freshness", "crs", "evidence_type", "product_type", "records", "assumptions", "limitations", "unsupported_outputs", "notice"],
  "properties": {
    "schema_version": { "const": "1.0.0" },
    "kind": { "const": "live-snapshot" },
    "dataset_id": { "$ref": "#/definitions/id" },
    "version": { "$ref": "#/definitions/version" },
    "id": { "$ref": "#/definitions/id" },
    "feed_id": { "$ref": "#/definitions/feed" },
    "is_fixture": { "type": "boolean" },
    "source": {
      "type": "object", "additionalProperties": false,
      "required": ["name", "url", "version", "raw_sha256", "license", "license_url", "attribution", "license_review", "is_official"],
      "properties": {
        "name": { "$ref": "#/definitions/text" },
        "url": { "$ref": "#/definitions/https" },
        "version": { "type": ["string", "null"], "minLength": 1, "maxLength": 120 },
        "raw_sha256": { "anyOf": [{ "$ref": "#/definitions/hash" }, { "type": "null" }] },
        "license": { "$ref": "#/definitions/text" },
        "license_url": { "anyOf": [{ "$ref": "#/definitions/https" }, { "type": "null" }] },
        "attribution": { "$ref": "#/definitions/text" },
        "license_review": { "enum": ["PERMITTED", "REVIEW_REQUIRED", "PROHIBITED"] },
        "is_official": { "type": "boolean" }
      }
    },
    "fetched_at": { "$ref": "#/definitions/time" },
    "source_issued_at": { "$ref": "#/definitions/nullableTime" },
    "freshness": {
      "type": "object", "additionalProperties": false,
      "required": ["basis", "as_of", "stale_after_seconds", "expires_at"],
      "properties": {
        "basis": { "enum": ["source_issue", "observation"] },
        "as_of": { "$ref": "#/definitions/nullableTime" },
        "stale_after_seconds": { "type": "integer", "minimum": 1, "maximum": 604800 },
        "expires_at": { "$ref": "#/definitions/nullableTime" }
      }
    },
    "crs": { "const": "OGC:CRS84" },
    "evidence_type": { "$ref": "#/definitions/evidence" },
    "product_type": { "$ref": "#/definitions/product" },
    "records": {
      "type": "array", "maxItems": 4096,
      "items": {
        "type": "object", "additionalProperties": false,
        "required": ["id", "label", "coordinates", "evidence_type", "observed_at", "issued_at", "valid_from", "valid_until", "measurements"],
        "properties": {
          "id": { "type": "string", "minLength": 1, "maxLength": 120 },
          "label": { "type": ["string", "null"], "minLength": 1, "maxLength": 240 },
          "coordinates": { "anyOf": [{ "type": "null" }, { "type": "array", "items": [{ "type": "number", "minimum": -180, "maximum": 180 }, { "type": "number", "minimum": -90, "maximum": 90 }], "additionalItems": false, "minItems": 2, "maxItems": 2 }] },
          "evidence_type": { "$ref": "#/definitions/evidence" },
          "observed_at": { "$ref": "#/definitions/nullableTime" },
          "issued_at": { "$ref": "#/definitions/nullableTime" },
          "valid_from": { "$ref": "#/definitions/nullableTime" },
          "valid_until": { "$ref": "#/definitions/nullableTime" },
          "measurements": {
            "type": "array", "maxItems": 16,
            "items": {
              "type": "object", "additionalProperties": false,
              "required": ["variable", "value", "unit", "qualifier", "evidence_type"],
              "properties": {
                "variable": { "enum": ["magnitude", "depth", "precipitation_accumulation", "precipitation_rate", "temperature", "water_level", "discharge", "pm25", "aqi"] },
                "value": { "type": ["number", "null"] },
                "unit": { "enum": ["magnitude", "km", "mm", "mm/h", "degC", "m", "m3/s", "ug/m3", "dimensionless"] },
                "qualifier": { "type": ["string", "null"], "minLength": 1, "maxLength": 120 },
                "evidence_type": { "$ref": "#/definitions/evidence" }
              }
            }
          }
        }
      }
    },
    "assumptions": { "$ref": "#/definitions/texts" },
    "limitations": { "type": "array", "allOf": [{ "$ref": "#/definitions/texts" }], "minItems": 1 },
    "unsupported_outputs": {
      "type": "object", "additionalProperties": false,
      "required": ["physical_inundation", "destroyed_buildings", "casualties", "repair_costs", "hydropower_downtime", "economic_loss"],
      "properties": {
        "physical_inundation": { "type": "null" }, "destroyed_buildings": { "type": "null" },
        "casualties": { "type": "null" }, "repair_costs": { "type": "null" },
        "hydropower_downtime": { "type": "null" }, "economic_loss": { "type": "null" }
      }
    },
    "notice": { "const": "Periodically updated conditions; not a real-time warning service." }
  },
  "definitions": {
    "id": { "type": "string", "pattern": "^[a-z0-9]+(?:-[a-z0-9]+)*$", "maxLength": 100 },
    "version": { "type": "string", "pattern": "^\\d+\\.\\d+\\.\\d+$", "maxLength": 40 },
    "hash": { "type": "string", "pattern": "^[a-f0-9]{64}$" },
    "time": { "type": "string", "format": "date-time", "pattern": "^(?!0000)\\d{4}-\\d{2}-\\d{2}T(?:[01]\\d|2[0-3]):[0-5]\\d:[0-5]\\d(?:\\.\\d{1,3})?Z$" },
    "nullableTime": { "anyOf": [{ "$ref": "#/definitions/time" }, { "type": "null" }] },
    "text": { "type": "string", "minLength": 1, "maxLength": 500 },
    "texts": { "type": "array", "maxItems": 32, "items": { "$ref": "#/definitions/text" } },
    "https": { "type": "string", "format": "uri", "pattern": "^https://", "maxLength": 1000 },
    "feed": { "enum": ["usgs", "noaa-gfs", "dhm", "bipad", "openaq", "open-meteo", "imerg", "contract-fixture"] },
    "evidence": { "enum": ["observed", "reported", "derived", "modelled", "hypothetical", "unknown"] },
    "product": { "enum": ["observation", "reported_event", "forecast", "official_warning", "scenario", "unknown"] }
  }
}
