{"assumptions":["All timestamps and workflow states are fixed synthetic test inputs, not actual fetches."],"crs":"OGC:CRS84","dataset_id":"atlas-live-contracts","evidence_type":"unknown","feed_id":"contract-fixture","fetched_at":"2026-10-06T12:00:00Z","freshness":{"as_of":"2026-10-06T12:00:00Z","basis":"source_issue","expires_at":null,"stale_after_seconds":21600},"id":"snapshot-ready","is_fixture":true,"kind":"live-snapshot","limitations":["This fixture contains no geographic facts, measurements, forecasts or warnings."],"notice":"Periodically updated conditions; not a real-time warning service.","product_type":"unknown","records":[{"coordinates":null,"evidence_type":"unknown","id":"synthetic-record","issued_at":null,"label":"Synthetic record without readings or location","measurements":[],"observed_at":null,"valid_from":null,"valid_until":null}],"schema_version":"1.0.0","source":{"attribution":"Himalayan Disaster Atlas contributors. Synthetic test cases, not provider observations.","is_official":false,"license":"MIT","license_review":"PERMITTED","license_url":"https://opensource.org/license/mit/","name":"Himalayan Disaster Atlas synthetic contract fixtures","raw_sha256":null,"url":"https://github.com/prasidupadhya/Himalayan-Disaster-Atlas","version":"1.0.0"},"source_issued_at":"2026-10-06T12:00:00Z","unsupported_outputs":{"casualties":null,"destroyed_buildings":null,"economic_loss":null,"hydropower_downtime":null,"physical_inundation":null,"repair_costs":null},"version":"1.0.0"}
